<?xml version="1.0" encoding="UTF-8"?>
<dokument xmlns="http://www.parlament.gov.rs/amandmani"
    xmlns:xsi="http://www.w3.org/2001/XMLSchema-instance"
    xsi:schemaLocation="http://www.parlament.gov.rs/amandmani file:/C:/Users/X/Desktop/skupstina.xsd">
    <naslov_sl_lista>
        <broj_lista></broj_lista>
        <cena></cena>
        <mesto_datum>
            <mesto></mesto>
            <datum></datum>
        </mesto_datum>
    </naslov_sl_lista>
    <propisi>
        <odbornik></odbornik>
        <preambula></preambula>
        <naziv_propisa></naziv_propisa>
        <uvodni_deo>
            <glava>
                <podaci_glave>
                    <naslov_glave></naslov_glave>
                    <broj_glave></broj_glave>
                </podaci_glave>
                <podnaslov_glave></podnaslov_glave>
                <clan>
                    <podaci_clana>
                        <naslov_clana></naslov_clana>
                        <broj_clana></broj_clana>
                    </podaci_clana>
                    <opis></opis>
                </clan>
            </glava>
        </uvodni_deo>
        <glavni_deo>
            <glava>
                <podaci_glave>
                    <naslov_glave></naslov_glave>
                    <broj_glave></broj_glave>
                </podaci_glave>
                <podnaslov_glave></podnaslov_glave>
                <clan>
                    <podaci_clana>
                        <naslov_clana></naslov_clana>
                        <broj_clana></broj_clana>
                    </podaci_clana>
                    <opis></opis>
                </clan>
            </glava>
        </glavni_deo>
        <zavrsni_deo>
            <glava>
                <podaci_glave>
                    <naslov_glave></naslov_glave>
                    <broj_glave></broj_glave>
                </podaci_glave>
                <podnaslov_glave></podnaslov_glave>
                <clan>
                    <podaci_clana>
                        <naslov_clana></naslov_clana>
                        <broj_clana></broj_clana>
                    </podaci_clana>
                    <opis></opis>
                </clan>
            </glava>
            <potpis_presednika></potpis_presednika>
        </zavrsni_deo>
    </propisi>
    <sadrzaj>
        <odbornik></odbornik>
        <broj_clana></broj_clana>
        <naziv_propisa></naziv_propisa>
    </sadrzaj>
</dokument>